{
  "source": "sistema-origem",
  "schema_version": "1.0",
  "entity": "clinical_report",
  "records": [
    {
      "id": "relatorio-001",
      "title": "Relatorio de atendimento 001",
      "sender": "Sistema Origem",
      "recipient": "RehabEasy",
      "created_at": "2026-06-09T12:00:00Z",
      "summary": "Resumo curto do registro enviado para importacao.",
      "content": "Conteudo completo do registro em texto plano.",
      "tags": ["triagem", "api", "rehabeasy"]
    }
  ]
}
